{
  "deck_key": "adani-ports",
  "presentation_id": "1WKRo-A3DamjYBT_dmuMazw8s7K9PHinFZFilkbwlb7c",
  "mode": "slides_api_batch_update",
  "request_summary": "Example request: tighten slide 3 headline while preserving layout and source all numeric claims.\n",
  "safety": {
    "no_pptx_roundtrip": true,
    "no_full_deck_replace": true,
    "preserve_object_ids": true,
    "human_review_required_for_external_send": true
  },
  "operations": [],
  "qa_gates": [
    "schema_validation",
    "no_full_replace",
    "object_id_check",
    "brand_lint",
    "claim_source_check",
    "render_export"
  ],
  "created_at": "2026-06-21T14:35:41.775068Z"
}
